{
  "apps": "./.app.json",
  "author": {
    "name": "Yuri Schimke"
  },
  "description": "Discover Compose components, inspect properties, and render catalog variants.",
  "extensions": {
    "com.openai": {
      "onboardingSkill": "./skills/compose-catalogs-setup/SKILL.md"
    }
  },
  "interface": {
    "capabilities": [
      "Interactive"
    ],
    "category": "Developer Tools",
    "defaultPrompt": [
      "Show the available Compose component catalogs.",
      "Review this UI Builder design against its catalog design guidelines."
    ],
    "developerName": "Yuri Schimke",
    "displayName": "Compose Catalogs",
    "longDescription": "Discover Compose components, render catalog variants, and review UI Builder designs against catalog guidelines through Compose Preview.",
    "shortDescription": "Discover and render Compose component catalogs."
  },
  "keywords": [
    "compose",
    "catalog",
    "material3",
    "wear",
    "design-review",
    "guidelines"
  ],
  "license": "Apache-2.0",
  "mcpServers": {
    "compose-preview-catalog": {
      "env_http_headers": {
        "X-Compose-Preview-Token": "COMPOSE_PREVIEW_TOKEN"
      },
      "type": "http",
      "url": "https://preview.coo.ee/mcp"
    }
  },
  "name": "compose-catalogs",
  "repository": "https://github.com/yschimke/compose-agent-plugins",
  "skills": "./skills/",
  "version": "0.10.0"
}
